2025-12-09 23:31:15,293 - Using device: cuda
2025-12-09 23:31:15,293 - Logging results to: logs/gdin_20251209_233115/gdin.log
2025-12-09 23:31:15,293 - Loading dataset ogbl-ddi...
2025-12-09 23:31:15,380 - Dataset loaded: 4267 nodes
2025-12-09 23:31:15,555 - Train pos edges: 1067911, Valid pos: 133489, Test pos: 133489
2025-12-09 23:31:15,555 - Valid neg edges: 101882, Test neg: 95599
2025-12-09 23:31:15,576 - Added self-loops: Total edges now = 1072178
2025-12-09 23:31:15,585 - ================================================================================
2025-12-09 23:31:15,585 - GDIN Configuration
2025-12-09 23:31:15,586 - ================================================================================
2025-12-09 23:31:15,586 - Hidden dim: 256
2025-12-09 23:31:15,586 - Num layers: 2
2025-12-09 23:31:15,586 - Dropout: 0.0
2025-12-09 23:31:15,586 - Num negatives: 3
2025-12-09 23:31:15,586 - Learning rate: 0.005
2025-12-09 23:31:15,586 - Epochs: 400
2025-12-09 23:31:15,586 - Use CN features: False
2025-12-09 23:31:15,586 - ================================================================================
2025-12-09 23:31:15,586 - 
================================================================================
2025-12-09 23:31:15,586 - Training GDIN (Phase 1: AUC Loss)
2025-12-09 23:31:15,586 - ================================================================================
2025-12-09 23:31:15,646 - Model: GDIN (2 layers, no-CN) | hidden_dim=256, dropout=0.0
2025-12-09 23:31:15,649 - [GDIN] Starting GDIN training (epochs=400, lr=0.005, wd=0.0001, num_neg=3, use_cn=False)
2025-12-09 23:31:20,010 - [GDIN] Epoch 0001 | loss 0.6931 | val@20 0.0025 | test@20 0.0026 | best 0.0025 (ep 1)
2025-12-09 23:31:35,393 - [GDIN] Epoch 0005 | loss 0.6523 | val@20 0.0302 | test@20 0.0159 | best 0.0302 (ep 5)
2025-12-09 23:31:54,434 - [GDIN] Epoch 0010 | loss 0.3432 | val@20 0.0065 | test@20 0.0075 | best 0.0302 (ep 5)
2025-12-09 23:32:13,561 - [GDIN] Epoch 0015 | loss 0.3221 | val@20 0.0117 | test@20 0.0163 | best 0.0302 (ep 5)
2025-12-09 23:32:32,723 - [GDIN] Epoch 0020 | loss 0.3054 | val@20 0.0190 | test@20 0.0294 | best 0.0302 (ep 5)
2025-12-09 23:32:51,864 - [GDIN] Epoch 0025 | loss 0.2866 | val@20 0.0255 | test@20 0.0313 | best 0.0302 (ep 5)
2025-12-09 23:33:11,099 - [GDIN] Epoch 0030 | loss 0.2578 | val@20 0.0031 | test@20 0.0001 | best 0.0302 (ep 5)
2025-12-09 23:33:30,222 - [GDIN] Epoch 0035 | loss 0.2423 | val@20 0.0002 | test@20 0.0003 | best 0.0302 (ep 5)
2025-12-09 23:33:49,249 - [GDIN] Epoch 0040 | loss 0.2329 | val@20 0.0420 | test@20 0.0503 | best 0.0420 (ep 40)
2025-12-09 23:34:11,309 - [GDIN] Epoch 0045 | loss 0.2260 | val@20 0.0569 | test@20 0.0061 | best 0.0569 (ep 45)
2025-12-09 23:34:31,064 - [GDIN] Epoch 0050 | loss 0.2219 | val@20 0.0353 | test@20 0.0065 | best 0.0569 (ep 45)
2025-12-09 23:34:50,700 - [GDIN] Epoch 0055 | loss 0.2139 | val@20 0.0994 | test@20 0.0168 | best 0.0994 (ep 55)
2025-12-09 23:35:10,427 - [GDIN] Epoch 0060 | loss 0.2078 | val@20 0.0350 | test@20 0.0073 | best 0.0994 (ep 55)
2025-12-09 23:35:29,870 - [GDIN] Epoch 0065 | loss 0.2035 | val@20 0.0091 | test@20 0.0031 | best 0.0994 (ep 55)
2025-12-09 23:35:49,871 - [GDIN] Epoch 0070 | loss 0.1994 | val@20 0.0130 | test@20 0.0029 | best 0.0994 (ep 55)
2025-12-09 23:36:09,719 - [GDIN] Epoch 0075 | loss 0.1919 | val@20 0.0201 | test@20 0.0024 | best 0.0994 (ep 55)
2025-12-09 23:36:29,437 - [GDIN] Epoch 0080 | loss 0.1835 | val@20 0.0306 | test@20 0.0029 | best 0.0994 (ep 55)
2025-12-09 23:36:49,057 - [GDIN] Epoch 0085 | loss 0.1772 | val@20 0.0230 | test@20 0.0063 | best 0.0994 (ep 55)
2025-12-09 23:37:08,873 - [GDIN] Epoch 0090 | loss 0.1732 | val@20 0.0514 | test@20 0.0116 | best 0.0994 (ep 55)
2025-12-09 23:37:28,311 - [GDIN] Epoch 0095 | loss 0.1693 | val@20 0.0232 | test@20 0.0066 | best 0.0994 (ep 55)
2025-12-09 23:37:47,838 - [GDIN] Epoch 0100 | loss 0.1669 | val@20 0.0280 | test@20 0.0108 | best 0.0994 (ep 55)
2025-12-09 23:38:07,433 - [GDIN] Epoch 0105 | loss 0.1639 | val@20 0.0330 | test@20 0.0188 | best 0.0994 (ep 55)
2025-12-09 23:38:26,877 - [GDIN] Epoch 0110 | loss 0.1637 | val@20 0.0801 | test@20 0.0315 | best 0.0994 (ep 55)
2025-12-09 23:38:46,368 - [GDIN] Epoch 0115 | loss 0.1591 | val@20 0.1152 | test@20 0.0670 | best 0.1152 (ep 115)
2025-12-09 23:39:05,857 - [GDIN] Epoch 0120 | loss 0.1548 | val@20 0.1008 | test@20 0.0305 | best 0.1152 (ep 115)
2025-12-09 23:39:25,334 - [GDIN] Epoch 0125 | loss 0.1571 | val@20 0.1614 | test@20 0.0930 | best 0.1614 (ep 125)
2025-12-09 23:39:44,961 - [GDIN] Epoch 0130 | loss 0.1568 | val@20 0.1155 | test@20 0.0331 | best 0.1614 (ep 125)
2025-12-09 23:40:04,458 - [GDIN] Epoch 0135 | loss 0.1474 | val@20 0.1355 | test@20 0.0522 | best 0.1614 (ep 125)
2025-12-09 23:40:23,982 - [GDIN] Epoch 0140 | loss 0.1441 | val@20 0.0843 | test@20 0.0444 | best 0.1614 (ep 125)
2025-12-09 23:40:43,524 - [GDIN] Epoch 0145 | loss 0.1427 | val@20 0.1416 | test@20 0.0452 | best 0.1614 (ep 125)
2025-12-09 23:41:03,564 - [GDIN] Epoch 0150 | loss 0.1380 | val@20 0.1515 | test@20 0.0407 | best 0.1614 (ep 125)
2025-12-09 23:41:23,618 - [GDIN] Epoch 0155 | loss 0.1355 | val@20 0.0745 | test@20 0.0100 | best 0.1614 (ep 125)
2025-12-09 23:41:43,245 - [GDIN] Epoch 0160 | loss 0.1455 | val@20 0.1483 | test@20 0.0465 | best 0.1614 (ep 125)
2025-12-09 23:42:02,599 - [GDIN] Epoch 0165 | loss 0.1364 | val@20 0.1604 | test@20 0.0998 | best 0.1614 (ep 125)
2025-12-09 23:42:22,016 - [GDIN] Epoch 0170 | loss 0.1333 | val@20 0.0998 | test@20 0.0869 | best 0.1614 (ep 125)
2025-12-09 23:42:41,233 - [GDIN] Epoch 0175 | loss 0.1297 | val@20 0.0892 | test@20 0.0678 | best 0.1614 (ep 125)
2025-12-09 23:43:00,611 - [GDIN] Epoch 0180 | loss 0.1267 | val@20 0.1059 | test@20 0.0344 | best 0.1614 (ep 125)
2025-12-09 23:43:20,247 - [GDIN] Epoch 0185 | loss 0.1249 | val@20 0.0689 | test@20 0.0315 | best 0.1614 (ep 125)
2025-12-09 23:43:39,686 - [GDIN] Epoch 0190 | loss 0.1227 | val@20 0.0805 | test@20 0.0399 | best 0.1614 (ep 125)
2025-12-09 23:43:58,994 - [GDIN] Epoch 0195 | loss 0.1219 | val@20 0.0407 | test@20 0.0138 | best 0.1614 (ep 125)
2025-12-09 23:44:18,464 - [GDIN] Epoch 0200 | loss 0.1211 | val@20 0.0751 | test@20 0.0586 | best 0.1614 (ep 125)
2025-12-09 23:44:37,679 - [GDIN] Epoch 0205 | loss 0.1202 | val@20 0.0827 | test@20 0.0576 | best 0.1614 (ep 125)
2025-12-09 23:44:56,955 - [GDIN] Epoch 0210 | loss 0.1198 | val@20 0.1193 | test@20 0.0709 | best 0.1614 (ep 125)
2025-12-09 23:45:16,191 - [GDIN] Epoch 0215 | loss 0.1175 | val@20 0.1335 | test@20 0.0502 | best 0.1614 (ep 125)
2025-12-09 23:45:35,421 - [GDIN] Epoch 0220 | loss 0.1145 | val@20 0.0553 | test@20 0.0343 | best 0.1614 (ep 125)
2025-12-09 23:45:54,666 - [GDIN] Epoch 0225 | loss 0.1146 | val@20 0.1478 | test@20 0.1153 | best 0.1614 (ep 125)
2025-12-09 23:46:13,910 - [GDIN] Epoch 0230 | loss 0.1153 | val@20 0.1796 | test@20 0.1793 | best 0.1796 (ep 230)
2025-12-09 23:46:33,063 - [GDIN] Epoch 0235 | loss 0.1250 | val@20 0.1959 | test@20 0.1095 | best 0.1959 (ep 235)
2025-12-09 23:46:52,209 - [GDIN] Epoch 0240 | loss 0.1186 | val@20 0.0834 | test@20 0.0098 | best 0.1959 (ep 235)
2025-12-09 23:47:11,739 - [GDIN] Epoch 0245 | loss 0.1121 | val@20 0.1396 | test@20 0.1088 | best 0.1959 (ep 235)
2025-12-09 23:47:31,010 - [GDIN] Epoch 0250 | loss 0.1105 | val@20 0.1130 | test@20 0.0878 | best 0.1959 (ep 235)
2025-12-09 23:47:50,380 - [GDIN] Epoch 0255 | loss 0.1084 | val@20 0.0722 | test@20 0.0399 | best 0.1959 (ep 235)
2025-12-09 23:48:09,657 - [GDIN] Epoch 0260 | loss 0.1065 | val@20 0.0873 | test@20 0.0500 | best 0.1959 (ep 235)
2025-12-09 23:48:28,870 - [GDIN] Epoch 0265 | loss 0.1048 | val@20 0.0832 | test@20 0.0483 | best 0.1959 (ep 235)
2025-12-09 23:48:48,125 - [GDIN] Epoch 0270 | loss 0.1036 | val@20 0.0696 | test@20 0.0271 | best 0.1959 (ep 235)
2025-12-09 23:49:07,391 - [GDIN] Epoch 0275 | loss 0.1034 | val@20 0.1249 | test@20 0.0860 | best 0.1959 (ep 235)
2025-12-09 23:49:26,519 - [GDIN] Epoch 0280 | loss 0.1037 | val@20 0.1739 | test@20 0.1155 | best 0.1959 (ep 235)
2025-12-09 23:49:45,672 - [GDIN] Epoch 0285 | loss 0.1025 | val@20 0.1774 | test@20 0.1363 | best 0.1959 (ep 235)
2025-12-09 23:50:04,828 - [GDIN] Epoch 0290 | loss 0.1046 | val@20 0.1824 | test@20 0.1458 | best 0.1959 (ep 235)
2025-12-09 23:50:23,923 - [GDIN] Epoch 0295 | loss 0.0988 | val@20 0.0946 | test@20 0.0627 | best 0.1959 (ep 235)
2025-12-09 23:50:42,923 - [GDIN] Epoch 0300 | loss 0.0987 | val@20 0.0738 | test@20 0.0460 | best 0.1959 (ep 235)
2025-12-09 23:51:02,027 - [GDIN] Epoch 0305 | loss 0.0983 | val@20 0.0763 | test@20 0.0404 | best 0.1959 (ep 235)
2025-12-09 23:51:22,266 - [GDIN] Epoch 0310 | loss 0.0968 | val@20 0.1083 | test@20 0.0566 | best 0.1959 (ep 235)
2025-12-09 23:51:41,490 - [GDIN] Epoch 0315 | loss 0.0956 | val@20 0.0900 | test@20 0.0604 | best 0.1959 (ep 235)
2025-12-09 23:52:00,655 - [GDIN] Epoch 0320 | loss 0.0972 | val@20 0.1693 | test@20 0.1275 | best 0.1959 (ep 235)
2025-12-09 23:52:19,875 - [GDIN] Epoch 0325 | loss 0.0954 | val@20 0.1443 | test@20 0.0993 | best 0.1959 (ep 235)
2025-12-09 23:52:39,032 - [GDIN] Epoch 0330 | loss 0.0942 | val@20 0.1561 | test@20 0.1130 | best 0.1959 (ep 235)
2025-12-09 23:52:58,268 - [GDIN] Epoch 0335 | loss 0.0936 | val@20 0.1125 | test@20 0.0517 | best 0.1959 (ep 235)
2025-12-09 23:53:17,435 - [GDIN] Epoch 0340 | loss 0.0920 | val@20 0.1214 | test@20 0.0766 | best 0.1959 (ep 235)
2025-12-09 23:53:36,546 - [GDIN] Epoch 0345 | loss 0.0928 | val@20 0.0995 | test@20 0.0354 | best 0.1959 (ep 235)
2025-12-09 23:53:55,901 - [GDIN] Epoch 0350 | loss 0.0946 | val@20 0.1214 | test@20 0.0690 | best 0.1959 (ep 235)
2025-12-09 23:54:15,133 - [GDIN] Epoch 0355 | loss 0.0937 | val@20 0.1267 | test@20 0.0509 | best 0.1959 (ep 235)
2025-12-09 23:54:34,401 - [GDIN] Epoch 0360 | loss 0.0901 | val@20 0.1173 | test@20 0.0610 | best 0.1959 (ep 235)
2025-12-09 23:54:53,610 - [GDIN] Epoch 0365 | loss 0.0897 | val@20 0.1421 | test@20 0.0715 | best 0.1959 (ep 235)
2025-12-09 23:55:13,023 - [GDIN] Epoch 0370 | loss 0.0887 | val@20 0.1174 | test@20 0.0647 | best 0.1959 (ep 235)
2025-12-09 23:55:32,220 - [GDIN] Epoch 0375 | loss 0.0887 | val@20 0.0859 | test@20 0.0422 | best 0.1959 (ep 235)
2025-12-09 23:55:51,357 - [GDIN] Epoch 0380 | loss 0.0872 | val@20 0.1267 | test@20 0.0814 | best 0.1959 (ep 235)
2025-12-09 23:56:10,689 - [GDIN] Epoch 0385 | loss 0.0867 | val@20 0.1213 | test@20 0.0887 | best 0.1959 (ep 235)
2025-12-09 23:56:10,689 - [GDIN] Early stopping at epoch 385 (no val improvement for 30 evals)
2025-12-09 23:56:10,690 - [GDIN] Done. Best val@20=0.1959 | test@20=0.1095 (epoch 235)
2025-12-09 23:56:10,690 - 
================================================================================
2025-12-09 23:56:10,691 - FINAL RESULTS - GDIN
2025-12-09 23:56:10,691 - ================================================================================
2025-12-09 23:56:10,691 - Best Validation Hits@20: 0.1959
2025-12-09 23:56:10,691 - Best Test Hits@20: 0.1095
2025-12-09 23:56:10,691 - Best Epoch: 235
2025-12-09 23:56:10,691 - Val-Test Gap: 0.0865 (44.1% relative)
2025-12-09 23:56:10,691 - ================================================================================
2025-12-09 23:56:10,691 - Results logged to: logs/gdin_20251209_233115/gdin.log
